{
  "version": "0.3",
  "inputs_digest": "aaaaaaaaaaaaaaaaaaaaaaaaaaaaaaaaaaaaaaaaaaaaaaaaaaaaaaaaaaaaaaaa",
  "outputs_digest": "bbbbbbbbbbbbbbbbbbbbbbbbbbbbbbbbbbbbbbbbbbbbbbbbbbbbbbbbbbbbbbbb",
  "model_fingerprint": "demo-model-1.0.0",
  "policy": {
    "name": "hello-world",
    "version": "0.1"
  },
  "meta": {
    "generated_at": "2025-09-08T00:00:00Z"
  }
}

